1369403175925669900,if you want to try a different brokerage firm join webull and we both get a free stock link down below httpstcoumokrhvex stockmarket usa stockmarketnews reddit appl gme msft f t v k fun bb sndl tsla a koss expr yolo ctrm amc zom,1355621754576588800,2021-03-09 21:42:14
1369403563236032520,appl de phare,1279439679243378691,2021-03-09 21:43:46
1369404011426820097,keelan my apple pie purchase will now be taxed httpstcocqamagyt,936745672551882752,2021-03-09 21:45:33
1369407540719673354,trading ideas appl apple break down point be very careful and ready to buy httpstcolayuaetyy free tradeofweek via ⟶ httpstcobcehqtprn httpstcocfkpgyntc,121158213,2021-03-09 21:59:34
1369407691127480322,central has a place for every scholar to research every activist to get involved every athlete to compete and every dreamer to discover the beauty in the world around them — and the strength that lies within central has a place for you apply today httpstcovspxharx,14845243,2021-03-09 22:00:10
1369407838712397842,honest affordable ice maker repairs near cityheights httpstcogzhqmcclv,1654654640,2021-03-09 22:00:45
1369407899622117385,whirlpool appliance repair san diego we repair all whirlpool appliances in san diego county call us today same day service httpstcorqdqwxht whirlpoolappliance sandiego sandiegoca whirlpoolappliance sandiegoappliancerepair,922991763106627584,2021-03-09 22:01:00
1369408032531218438,huguette rbctrading reciknows pikespeaktrades themicr i have a more bearish count on appl but i do like the look of a flat here httpstcopgmsqzarq,1254157847387992065,2021-03-09 22:01:31
1369408099321253891,stocks that are strong buys on sale sens nio appl bngo posh i wen httpstcostoghma via youtube,738355816923811840,2021-03-09 22:01:47
1369408407816568851,apple aapl appl apple break down point be very careful and ready to b long or short it with btc on trade httpstcoylsizqdd httpstcobeyzvtiq,1053454356878479361,2021-03-09 22:03:01
1369408667662049280,huguette rbctrading reciknows pikespeaktrades themicr i have a more bearish count on appl but i do like the look of a flat here has some confluence for a bounce httpstcoifabarxvv,1254157847387992065,2021-03-09 22:04:03
1369414103496802312,dnuts ive been short appl mentally for years now fortunately never on paper amzn theyre both fine but so mature no rabbit is coming out of those hats gbtc thats an interesting one these days blockfi and all fun times,175960015,2021-03-09 22:25:39
