1369354346337427458,options flow stream update amzn aapl goog msft tsla zm vix ndx spy qqq spx optionstrading optionsflow optionstrade optiontrading stock stocks stockmarket investment investing invest investor investors uoa httpstcojjhrpqst httpstcoaewsqzfy,706297891070087168,2021-03-09 18:28:12
1369354381615915013,titansventures abhicryptomedia goog,1354548682180284418,2021-03-09 18:28:20
1369354387433398273,let’s spin the webull wheel shares of goog have been added httpstcosasqewjtz,4617423140,2021-03-09 18:28:21
1369354402948145161,started trading with k down to k back up to k a big thank you to this community httpstcopzzdhtgwsj aytu vetx fb sq goog zm amzn mana jnug arkk sklz wish iea aapl glsi apps sft sfix acad amc soxl wish linkx gme sos spy httpstcorqbzrvaojl,1369353784904871939,2021-03-09 18:28:25
1369354475098566657,let’s spin the webull wheel shares of goog have been added httpstcoihzwpvmu,1368545082161434628,2021-03-09 18:28:42
1369354547232088064,bmy has a poor technical analysis score ta score breakdown of categories candle score poor moving average score weak momentum score poor stocks stock stockmarket investment investing httpstcojenlrwb httpstcoebydhfc httpstcokgcjdkeav,438262278,2021-03-09 18:29:00
1369354725393657858,pierce morgan is leaving goog morning britain£ £,1280732812098916352,2021-03-09 18:29:42
1369354781731459072,disneyplus has surpassed million global subscribers in just months httpstcodijkguvg cc mediagazer techmeme dis t nflx goog appl amzn,855930713966862336,2021-03-09 18:29:56
1369355011738767363,looks like profits from canadian lps are going into cura curlf for earnings after the close 🤫 spy aapl goog fb amzn tsla nio cgc acb cron tlry apha sndl vff mmen hexo gtii trul msos numi cybn ftrp trip cmps mmed mara riot amc dnn gme ba httpstcoxfhystbp,428724153,2021-03-09 18:30:50
1369355029040295945,let’s spin the webull wheel shares of goog have been added httpstcovvbmrmrx,1368545082161434628,2021-03-09 18:30:54
1369355195419885569,studentmoney documentingbtc goog for you,1360937442531020801,2021-03-09 18:31:34
1369355514237251584,let’s spin the webull wheel shares of goog have been added httpstcoedehaaeg,829422338835771392,2021-03-09 18:32:50
1369355542594916353,options flow grid update csco optionstrading cisco shares ⬆️ to optionsflow stocks stock stockmarket investing investment httpstcoihjtleqg httpstcouxbexicbyg httpstcogiuaqybka,706269135404081152,2021-03-09 18:32:57
1369355796908277771,dkng spy aapl goog fb amzn tsla nio cgc acb cron tlry apha sndl vff mmen hexo gtii trul msos numi cybn ftrp trip cmps mmed mara riot amc dnn gme ba draftkings says ma is on the radar httpstcohexbhrk httpstcolsikdgx,1288121497073016837,2021-03-09 18:33:58
